<?xml version="1.0"?>
<Records xmlns:xsi="http://www.w3.org/2001/XMLSchema-instance"
         xsi:noNamespaceSchemaLocation="giapi-apply-config.xsd">
    <Apply name="apply" timeout="1000">
        <SequenceCommand>TEST</SequenceCommand>
        <SequenceCommand>REBOOT</SequenceCommand>
        <SequenceCommand>INIT</SequenceCommand>
        <SequenceCommand>DATUM</SequenceCommand>
        <SequenceCommand>PARK</SequenceCommand>
        <SequenceCommand>VERIFY</SequenceCommand>
        <SequenceCommand>END_VERIFY</SequenceCommand>
        <SequenceCommand>OBSERVE</SequenceCommand>
        <SequenceCommand>END_OBSERVE</SequenceCommand>
        <SequenceCommand>PAUSE</SequenceCommand>
        <SequenceCommand>CONTINUE</SequenceCommand>
        <SequenceCommand>STOP</SequenceCommand>
        <SequenceCommand>ABORT</SequenceCommand>
    </Apply>

    <Apply name="ao:apply" timeout="1000">
        <ConfigRecord name="ao:config">
            <ConfigSet name="configAo">
                <field>useAo</field>
                <field>magnitudeI</field>
                <field>r0</field>
                <field>optimize</field>
                <field>useLastVals</field>
            </ConfigSet>
            <ConfigSet name="configCal">
                <field>useCal</field>
                <field>magnitudeH</field>
            </ConfigSet>
        </ConfigRecord>
        <SequenceCommand>GUIDE</SequenceCommand>
        <SequenceCommand>END_GUIDE</SequenceCommand>
    </Apply>

    <Apply name="inst:apply" timeout="1000">
        <ConfigRecord name="inst:config">
            <ConfigSet name="configIfs">
                <field>integrationTime</field>
                <field>readoutMode</field>
                <field>numReads</field>
                <field>numCoadds</field>
                <field>startx</field>
                <field>starty</field>
                <field>endx</field>
                <field>endy</field>
            </ConfigSet>

            <ConfigSet name="configFOVIfsOffset">
                <field>xTarget</field>
                <field>yTarget</field>
            </ConfigSet>

            <ConfigSet name="configPolarizer">
                <field>deploy</field>
                <field>angle</field>
            </ConfigSet>

            <ConfigSet name="observationMode">
                <field>modeName</field>
            </ConfigSet>

            <ConfigSet name="selectAdc">
                <field>deploy</field>
                <field>overrideCas</field>
                <field>overrideZen</field>
                <field>orientation</field>
                <field>power</field>
            </ConfigSet>

            <ConfigSet name="selectPupilCamera">
                <field>deploy</field>
            </ConfigSet>

            <ConfigSet name="selectSource">
                <field>sourceIr</field>
                <field>sourceVis</field>
                <field>powerSC</field>
                <field>attenuationSC</field>
            </ConfigSet>

            <ConfigSet name="selectShutter">
                <field>entranceShutter</field>
                <field>calExitShutter</field>
                <field>calEntranceShutter</field>
                <field>calReferenceShutter</field>
                <field>calScienceShutter</field>
            </ConfigSet>

            <ConfigSet name="takeExposure">
                <field>selection</field>
                <field>intTime</field>
                <field>filename</field>
            </ConfigSet>
            <!--Apply Sequence Command Calibration Sets -->

            <ConfigSet name="cal:acquireWhiteFringe">
                <field>mark</field>
            </ConfigSet>

            <ConfigSet name="calToAoAlign">
                <field>phase</field>
            </ConfigSet>

            <ConfigSet name="centerPinhole">
                <field>mark</field>
            </ConfigSet>

            <ConfigSet name="ao:dmShape">
                <field>filename</field>
                <field>dmFlag</field>
            </ConfigSet>

            <ConfigSet name="ao:measureAOWFSCentroids">
                <field>mark</field>
            </ConfigSet>

            <ConfigSet name="cal:measureCalCentroids">
                <field>mark</field>
            </ConfigSet>

            <ConfigSet name="cal:measureHowfsOffsets">
                <field>filename</field>
            </ConfigSet>

            <ConfigSet name="takeDark">
                <field>selection</field>
                <field>intTime</field>
                <field>filename</field>
            </ConfigSet>

            <ConfigSet name="takeFlat">
                <field>selection</field>
                <field>intTime</field>
                <field>filename</field>
            </ConfigSet>

            <ConfigSet name="cal:transMaps">
                <field>filename</field>
            </ConfigSet>
            <!--Apply Sequence Command Engineering Sets (Miscellaneous access functions)-->

            <ConfigSet name="configAoSpatialFilter">
                <field>mode</field>
                <field>target</field>
                <field>now</field>
            </ConfigSet>

            <ConfigSet name="configSteeringMirrors">
                <field>selection</field>
                <field>track</field>
                <field>tip</field>
                <field>tilt</field>
                <field>focus</field>
            </ConfigSet>

            <ConfigSet name="correct">
                <field>selection</field>
            </ConfigSet>

            <ConfigSet name="ifs:log">
                <field>temperatures</field>
                <field>filename</field>
                <field>rate</field>
            </ConfigSet>

            <ConfigSet name="ifs:selectIfsFilter">
                <field>maskStr</field>
            </ConfigSet>

            <ConfigSet name="selectFocalPlaneMask">
                <field>maskStr</field>
            </ConfigSet>

            <ConfigSet name="selectLyotMask">
                <field>maskStr</field>
            </ConfigSet>

            <ConfigSet name="selectPupilPlaneMask">
                <field>maskStr</field>
            </ConfigSet>

            <ConfigSet name="statistics">
                <field>statStat</field>
                <field>statName</field>
                <field>statSelected</field>
            </ConfigSet>

            <ConfigSet name="alignAndCalib">
                <field>part1</field>
            </ConfigSet>
        </ConfigRecord>
    </Apply>
</Records>
